Название дивана,Цена,Ссылка на диван
Диван прямой Нумо Velvet Pink,38990,https://www.divan.ru/product/divan-numo-velvet-pink
Банкетка Вайли Velvet Light,10990,https://www.divan.ru/product/banketka-vajli-velvet-light
Диван прямой Спейс Velvet Olive,66990,https://www.divan.ru/product/divan-spejs-velvet-olive
Диван прямой Нумо Мини Textile Light,26990,https://www.divan.ru/product/divan-numo-mini-textile-light
Диван прямой Клаймар Velvet Terra,59990,https://www.divan.ru/product/divan-klajmar-velvet-terra
Диван прямой Риен Velvet Stone,58990,https://www.divan.ru/product/divan-rien-velvet-stone
Кресло Кото Cozy Beige,32990,https://www.divan.ru/product/kreslo-koto-cozy-beige
Диван прямой Льери Мини Velvet Yellow,64990,https://www.divan.ru/product/divan-leri-mini-velvet-yellow
Диван прямой Нумо Velvet Green,38990,https://www.divan.ru/product/divan-numo-velvet-green
Диван прямой Нумо Мини Textile Yellow,26990,https://www.divan.ru/product/divan-numo-mini-textile-yellow
Диван прямой Лилт Bucle Lilac,82990,https://www.divan.ru/product/divan-lilt-bucle-lilac
Диван угловой Онте Bucle Silver,109990,https://www.divan.ru/product/divan-uglovoj-onte-bucle-silver
Кресло Витио Velvet Yellow,22990,https://www.divan.ru/product/kreslo-vitio-velvet-yellow-new
Диван прямой Эби Velvet Coral,66990,https://www.divan.ru/product/divan-ebi-velvet-coral
Диван прямой Виена Velvet Smoke,64990,https://www.divan.ru/product/divan-viena-time-grey
Кресло Пайпел-2 Bucle Forest,40990,https://www.divan.ru/product/kreslo-pajpel-2-bucle-forest
Диван прямой Види Textile Navy Blue,25990,https://www.divan.ru/product/divan-vidi-textile-navy-blue
Диван модульный Риббл-1 Bucle Mint,78980,https://www.divan.ru/product/modulnyj-divan-ribbl-1-bucle-mint
Диван угловой Аллаум Linia Stone,54990,https://www.divan.ru/product/divan-uglovoj-allaum-linia-stone
Кресло Ансил Bucle Milk,31990,https://www.divan.ru/product/kreslo-ansil-bucle-milk
Диван угловой Аронт Мини Velvet Olive,59990,https://www.divan.ru/product/divan-uglovoj-aront-mini-velvet-olive
Диван прямой Ларонсо Soft Blue,94990,https://www.divan.ru/product/divan-laronso-soft-blue
Пуф Кропс Bucle Lilac,8990,https://www.divan.ru/product/puf-krops-bucle-lilac
Диван прямой Сваут Velvet Mustard,66990,https://www.divan.ru/product/divan-svaut-velvet-mustard
Пуф Кофи Velvet Light,4590,https://www.divan.ru/product/puf-kofi-velvet-light
Диван прямой Тилар Cozy Milk,31990,https://www.divan.ru/product/divan-tilar-cozy-milk
Диван прямой Бонс-Т Velvet Emerald,46990,https://www.divan.ru/product/divan-bons-t-velvet-emerald
Кресло Тилар Textile Yellow,23990,https://www.divan.ru/product/kreslo-tilar-textile-yellow
Диван прямой Инес Vertical Blue,46990,https://www.divan.ru/product/divan-ines-vertical-blue
Диван прямой Лави Velvet Moss,44990,https://www.divan.ru/product/divan-lavi-velvet-moss
Диван прямой Викс Textile Silver,23990,https://www.divan.ru/product/divan-viks-textile-silver
,67990,https://www.divan.ru/product/divan-uglovoj-darol-velvet-silver
,43990,https://www.divan.ru/product/kreslo-londi-cozy-ivory
,59990,https://www.divan.ru/product/divan-uglovoj-nordika-mini-velvet-coral
,79990,https://www.divan.ru/product/divan-bonent-velvet-eclipse
,46990,https://www.divan.ru/product/divan-lille-velvet-atlantic
,9990,https://www.divan.ru/product/puf-dzen-1-velvet-beige
,74990,https://www.divan.ru/product/divan-uglovoj-edvin-velvet-terra
,44990,https://www.divan.ru/product/divan-sannes-velvet-terra
,27990,https://www.divan.ru/product/divan-rotterdam-velvet-silver
,66990,https://www.divan.ru/product/divan-svaut-velvet-beige
,42990,https://www.divan.ru/product/divan-uglovoj-staus-velvet-olive
,69990,https://www.divan.ru/product/divan-term-velvet-beige
,22990,https://www.divan.ru/product/kreslo-krovat-kejses-velvet-grey
,21990,https://www.divan.ru/product/kushetka-rint-bucle-pink
,39990,https://www.divan.ru/product/divan-tajlin-velvet-yellow
,29990,https://www.divan.ru/product/kreslo-elvit-cozy-ivory
,59990,https://www.divan.ru/product/divan-slipson-velvet-silver
